{
  "$schema": "./agent-catalog.schema.json",
  "schemaVersion": "1.0.0",
  "catalogId": "ai-native-pbm-commercial-full-service",
  "title": "CVS Caremark small-group offering operating agent catalog",
  "domainIds": [
    "commercial-client",
    "implementation-eligibility",
    "claims-benefit",
    "clinical-um",
    "formulary",
    "pharmacy-network",
    "pricing-mac",
    "manufacturer-rebates",
    "finance-settlement",
    "stakeholder-service",
    "data-analytics",
    "compliance-security",
    "quality-resilience"
  ],
  "currentGlassAgentIds": [
    "pa-intake",
    "plan-design",
    "integrity-triage",
    "eligibility-resolver",
    "appeal-drafter",
    "member-service",
    "data-agent",
    "account-management",
    "rebate-protection",
    "leakage-challenge",
    "data-agent-tester"
  ],
  "domains": [
    {
      "id": "commercial-client",
      "name": "Commercial and client management",
      "commercialPurpose": "Sell and retain the highly automated, transparent CVS Caremark Glass offering for small group employers.",
      "processes": [
        {
          "id": "commercial-client.market-opportunity-qualification",
          "name": "Market opportunity qualification",
          "domain": "commercial-client",
          "description": "Qualify small group employer opportunities for the CVS Caremark Glass offering against approved group eligibility, funding arrangements, channel, launch geography, and service economics.",
          "trigger": {
            "type": "event",
            "event": "Lead or broker opportunity received"
          },
          "owner": "Commercial strategy",
          "accountableAuthority": "Chief commercial officer",
          "inputs": [
            "CRM opportunity",
            "census and claims summary",
            "broker requirements"
          ],
          "outputs": [
            "qualification score",
            "pursuit decision brief"
          ],
          "sourceOfTruth": [
            "CRM",
            "approved market segmentation"
          ],
          "executionMode": "hybrid",
          "authoritativeCalculation": {
            "required": true,
            "authority": "deterministic-system",
            "system": "approved opportunity scoring model"
          },
          "tools": [
            {
              "name": "commercial-workbench",
              "access": "write",
              "scope": "opportunity scoring and notes"
            }
          ],
          "evidence": [
            "scored criteria and source links"
          ],
          "consequenceClasses": [
            "money",
            "contract"
          ],
          "riskTier": "moderate",
          "autonomy": "recommend",
          "approval": {
            "required": true,
            "authority": "Sales leadership",
            "conditions": [
              "pursue, no-bid, or invest decision"
            ]
          },
          "sla": {
            "target": "2 business days",
            "escalation": "Commercial operations leader"
          },
          "controls": [
            "Use approved scoring weights and current pipeline permissions"
          ],
          "metrics": [
            {
              "name": "qualified-opportunity win rate",
              "target": ">= 30%"
            }
          ],
          "failureHandling": {
            "fallback": "Route to manual qualification",
            "escalation": "Missing economics to finance",
            "recovery": "Rescore after data correction"
          },
          "downstreamEvents": [
            "commercial.rfp-started"
          ],
          "currentGlassAgents": [
            "data-agent"
          ]
        },
        {
          "id": "commercial-client.rfp-response",
          "name": "RFP response management",
          "domain": "commercial-client",
          "description": "Prepare evidence-backed small-group employer and broker proposals, standard questionnaires, and RFP responses for the Caremark Glass offering.",
          "trigger": {
            "type": "event",
            "event": "RFP accepted for pursuit"
          },
          "owner": "Proposal management",
          "accountableAuthority": "Chief commercial officer",
          "inputs": [
            "RFP documents",
            "approved content library",
            "deal assumptions"
          ],
          "outputs": [
            "requirements matrix",
            "response package",
            "exception log"
          ],
          "sourceOfTruth": [
            "RFP repository",
            "approved product and legal content"
          ],
          "executionMode": "hybrid",
          "authoritativeCalculation": {
            "required": false,
            "authority": "not-applicable",
            "system": null
          },
          "tools": [
            {
              "name": "proposal-workspace",
              "access": "write",
              "scope": "draft answers and trace requirements"
            }
          ],
          "evidence": [
            "answer-to-source citations",
            "review history"
          ],
          "consequenceClasses": [
            "contract",
            "external_communication"
          ],
          "riskTier": "high",
          "autonomy": "recommend",
          "approval": {
            "required": true,
            "authority": "Legal, product, and commercial owners",
            "conditions": [
              "external submission"
            ]
          },
          "sla": {
            "target": "By procurement deadline",
            "escalation": "Executive deal sponsor"
          },
          "controls": [
            "No unsupported capability, guarantee, or security claim"
          ],
          "metrics": [
            {
              "name": "requirements answered and approved",
              "target": "100%"
            }
          ],
          "failureHandling": {
            "fallback": "Assign unanswered items to human owners",
            "escalation": "Material exception to deal sponsor",
            "recovery": "Version and reapprove corrected response"
          },
          "downstreamEvents": [
            "commercial.proposal-requested"
          ],
          "currentGlassAgents": [
            "data-agent"
          ]
        },
        {
          "id": "commercial-client.proposal-underwriting",
          "name": "Proposal pricing and underwriting",
          "domain": "commercial-client",
          "description": "Compare approved Caremark TrueCost and drug-level rebate configurations using 100% rebate pass-through, separately disclosed fees, net cost, and cost to serve.",
          "trigger": {
            "type": "request",
            "event": "Priced proposal requested"
          },
          "owner": "Commercial underwriting",
          "accountableAuthority": "Chief financial officer",
          "inputs": [
            "claims and census",
            "benefit assumptions",
            "network and rebate forecasts",
            "expense loads",
            "Approved Caremark TrueCost or drug-level rebate terms and small-group product eligibility"
          ],
          "outputs": [
            "priced offer",
            "margin bridge",
            "sensitivity cases"
          ],
          "sourceOfTruth": [
            "versioned underwriting model",
            "approved rate cards"
          ],
          "executionMode": "deterministic",
          "authoritativeCalculation": {
            "required": true,
            "authority": "deterministic-system",
            "system": "versioned underwriting engine"
          },
          "tools": [
            {
              "name": "underwriting-engine",
              "access": "execute",
              "scope": "calculate approved deal scenarios"
            }
          ],
          "evidence": [
            "input snapshot",
            "calculation version",
            "scenario outputs"
          ],
          "consequenceClasses": [
            "money",
            "contract",
            "external_communication"
          ],
          "riskTier": "critical",
          "autonomy": "recommend",
          "approval": {
            "required": true,
            "authority": "Finance pricing committee",
            "conditions": [
              "all external prices and nonstandard terms"
            ]
          },
          "sla": {
            "target": "5 business days",
            "escalation": "VP underwriting"
          },
          "controls": [
            "Margin floors, delegated limits, and independent model checks",
            "Require 100% rebate pass-through and separately disclosed service fees; prohibit retained-rebate economics"
          ],
          "metrics": [
            {
              "name": "realized-to-underwritten margin variance",
              "target": "<= 5%"
            }
          ],
          "failureHandling": {
            "fallback": "Hold quote and calculate manually",
            "escalation": "Model or data variance to finance",
            "recovery": "Rerun from immutable input snapshot"
          },
          "downstreamEvents": [
            "commercial.offer-approved"
          ],
          "currentGlassAgents": [
            "data-agent",
            "plan-design"
          ]
        },
        {
          "id": "commercial-client.contracting",
          "name": "Contract negotiation and configuration",
          "domain": "commercial-client",
          "description": "Translate approved Caremark small-group terms into versioned pricing-model selection, 100% rebate pass-through, fees, benefit packages, member rebate elections, and obligations.",
          "trigger": {
            "type": "event",
            "event": "Prospect selects offer for contracting"
          },
          "owner": "Contract management",
          "accountableAuthority": "General counsel",
          "inputs": [
            "approved proposal",